{
    "schemaVersion": 1,
    "title": "Azure MCP & Skills Ecosystem",
    "brandProfile": "design/brand-profiles/fluent-aligned.json",
    "theme": "dark",
    "locale": "en",
    "date": "2026-08-13",
    "footer": "Azure Skills + Azure MCP · conceptual ecosystem",
    "confidentiality": "Conceptual reference architecture",
    "slides": [
        {
            "id": "advisor-azure-skills-ecosystem",
            "layout": "diagram",
            "title": "Azure MCP & Skills Ecosystem",
            "takeaway": "Advisor acts as the central orchestrator, composing scenario-specific skills and Azure MCP tools over shared ARM control and ARG resource intelligence.",
            "diagram": {
                "path": "diagrams/advisor-azure-skills-ecosystem.json",
                "alt": "Five-layer conceptual architecture with Advisor at the center, invoking Resiliency, Chaos Studio, and Azure Monitor skills above Azure MCP tools and shared ARM and ARG planes."
            },
            "sources": [
                {
                    "label": "Introduction to Azure Advisor",
                    "url": "https://learn.microsoft.com/azure/advisor/advisor-overview",
                    "accessed": "2026-08-13"
                },
                {
                    "label": "What is Azure Resource Manager?",
                    "url": "https://learn.microsoft.com/azure/azure-resource-manager/management/overview",
                    "accessed": "2026-08-13"
                },
                {
                    "label": "What is Azure Resource Graph?",
                    "url": "https://learn.microsoft.com/azure/governance/resource-graph/overview",
                    "accessed": "2026-08-13"
                },
                {
                    "label": "Azure Monitor overview",
                    "url": "https://learn.microsoft.com/azure/azure-monitor/fundamentals/overview",
                    "accessed": "2026-08-13"
                },
                {
                    "label": "What is Azure Chaos Studio?",
                    "url": "https://learn.microsoft.com/azure/chaos-studio/chaos-studio-overview",
                    "accessed": "2026-08-13"
                }
            ],
            "notes": "Audience: Azure executives, product leaders, and engineering stakeholders.\n\nPurpose: show how Azure Skills and Azure MCP can operate as one composable ecosystem, with Advisor at the orchestration center.\n\nNarrative:\n1. A user or agent starts with an outcome: optimize, assess, observe, or validate.\n2. Advisor interprets the scenario, prioritizes the response, and delegates to specialist skills.\n3. Resiliency, Chaos Studio, Azure Monitor, and additional Azure skills can collaborate based on the scenario.\n4. Each skill selects the minimum Azure MCP tools needed to discover, analyze, act, and validate.\n5. The ecosystem shares Azure Resource Manager for authenticated and authorized management operations and Azure Resource Graph for at-scale resource and recommendation queries.\n\nAccuracy note: the Advisor-to-skill orchestration, skill-to-skill calls, and Azure MCP tool surface are a conceptual operating model supplied in the brief; they do not depict Azure's private service implementation. The diagram uses 'ARG resource data plane' as an executive abstraction for resource metadata and recommendation queries. Azure Resource Graph is not the native runtime data plane of each underlying Azure service.\n\nTakeaway: Advisor turns a catalog of specialist skills and MCP tools into one scenario-driven operating model over consistent Azure control and resource intelligence planes."
        }
    ]
}