{
    "schemaVersion": 1,
    "title": "Advisor data publishing",
    "brandProfile": "design/brand-profiles/fluent-aligned.json",
    "theme": "light",
    "locale": "en",
    "date": "2026-08-12",
    "footer": "Azure Advisor · conceptual data distribution",
    "confidentiality": "Microsoft internal — conceptual",
    "slides": [
        {
            "id": "advisor-kusto-publishing",
            "layout": "diagram",
            "eyebrow": "Azure Advisor · governed distribution",
            "title": "One dataset, two governed consumption paths",
            "takeaway": "Advisor computes recommendations once, then serves customer and internal teams through independently governed publication paths.",
            "subtitle": "Azure Resource Graph serves customers; internal Kusto serves first-party teams. Each path enforces its own authorization scope.",
            "diagram": {
                "path": "diagrams/advisor-kusto-publishing.json",
                "alt": "Three-layer architecture showing Advisor computing recommendations once, publishing them to Azure Resource Graph and internal Kusto, then applying customer Azure RBAC and internal TPID authorization."
            },
            "sources": [
                {
                    "label": "Introduction to Azure Advisor",
                    "url": "https://learn.microsoft.com/azure/advisor/advisor-overview",
                    "accessed": "2026-08-12"
                },
                {
                    "label": "Query for Advisor data in Azure Resource Graph",
                    "url": "https://learn.microsoft.com/azure/advisor/advisor-azure-resource-graph",
                    "accessed": "2026-08-12"
                }
            ],
            "notes": "Purpose: explain, for an internal engineering and support audience, how a single Advisor recommendation dataset is published to two different consumption surfaces with two different authorization models.\n\nFlow (left to right):\n1. Data production and distribution — the Advisor engine computes recommendations on a schedule into recommendation datasets (snapshots, scores, tracking metadata). Those datasets are synced to Azure Resource Graph (ARG) and exported/ingested into internal first-party (1P) Kusto clusters.\n2. Customer experience — customers query Advisor through ARM / ARG endpoints; Azure RBAC authorizes access scoped to subscription, resource group, and tenant, so each customer sees only their own recommendation data.\n3. Internal 1P analytics — the 1P Kusto clusters hold Advisor data for all customers. A TPID authorization layer applies TPID-based RBAC that partitions data by TPID (tenants and subscriptions). CSAM and support/account personas can read only the TPIDs assigned to them; an admin persona bypasses TPID scoping for full access.\n\nAuthorization models summarized:\n- Customer path: Azure RBAC via ARM/ARG. Scope = subscription → resource group → tenant.\n- Internal path: TPID-based RBAC in Kusto. Scope = TPID → tenants → subscriptions.\n- Admin path: admin role in Kusto. Scope = all TPIDs (all customer data).\n\nKey points: the same Advisor data is delivered to multiple experiences; external and internal usage use different authorization models; internal Kusto contains data for all customers; TPID is the top-level security boundary for internal usage. Access to Kusto is audited and remains within Microsoft internal boundaries. ARG and Kusto exports run on a scheduled cadence to keep data fresh.\n\nSourcing note: Azure Advisor and its availability in Azure Resource Graph are public (see sources). The internal 1P Kusto clusters, TPID authorization model, and CSAM/support/admin personas are drawn from the provided internal description and are not documented in public Microsoft sources; treat them as conceptual internal architecture, not a verified deployed topology. Confirm cadence, audit, and exact scope wording with the owning team before external use."
        }
    ]
}